{
  "$schema": "http://json-schema.org/draft-07/schema#",
  "$id": "urn:outcomebound:schema:validation-plan:1",
  "title": "OutcomeBound validation plan v1",
  "description": "A list of named changed-risk claims, each judged by its command's exit status. Each command is an argv LIST, never a shell string: the runner uses shell=False, so \"pytest -q\" as one string is an executable named 'pytest -q' and will not run.",
  "type": "object",
  "additionalProperties": false,
  "required": [
    "version",
    "claims"
  ],
  "properties": {
    "version": {
      "const": 1
    },
    "cwd": {
      "type": "string"
    },
    "timeout_seconds": {
      "type": "number",
      "description": "Seconds after which each claim that sets none of its own is stopped, with everything it started, and reads UNVERIFIED. Optional: with neither this nor the claim's own timeout_seconds there is no timeout, and a claim waits for its command however long it runs."
    },
    "claims": {
      "type": "array",
      "minItems": 1,
      "items": {
        "type": "object",
        "additionalProperties": false,
        "required": [
          "name",
          "risk",
          "kind",
          "command"
        ],
        "properties": {
          "name": {
            "type": "string"
          },
          "risk": {
            "type": "string"
          },
          "kind": {
            "type": "string",
            "enum": [
              "static",
              "test",
              "build",
              "runtime"
            ]
          },
          "required": {
            "type": "boolean"
          },
          "command": {
            "type": "array",
            "minItems": 1,
            "items": {
              "type": "string"
            }
          },
          "required_paths": {
            "type": "array",
            "items": {
              "type": "string"
            }
          },
          "executes_tests": {
            "type": "object",
            "additionalProperties": false,
            "description": "Optional contract that the command executes at least one test, declared by the project: no_tests_exit, the command's own exit code for \"no tests collected\" (pytest's is 5), or ran_output, a regular expression the output holds where a test ran; exactly one. A run that executed none reads when_none (UNVERIFIED by default, or FAIL), with the command's own result kept in the detail. Without it, only the exit status counts.",
            "properties": {
              "no_tests_exit": {
                "type": "integer"
              },
              "ran_output": {
                "type": "string"
              },
              "when_none": {
                "enum": [
                  "UNVERIFIED",
                  "FAIL"
                ]
              }
            }
          },
          "produces": {
            "type": "object",
            "additionalProperties": false,
            "required": [
              "paths"
            ],
            "description": "Optional output the command must leave. Where the command exits 0, each path must be absent before the run and present after it, or present both times with a changed modification time, size or content (a directory: any file in it); otherwise the claim reads when_missing (UNVERIFIED by default, or FAIL) and the report names the path. A nonzero exit stays FAIL. With executes_tests on the same claim, the stricter verdict wins. The runner never opens an output to judge it: a produced file proves only that the command wrote it, not that its content is right. Nothing is deleted or moved.",
            "properties": {
              "paths": {
                "type": "array",
                "minItems": 1,
                "description": "Paths relative to the plan's working directory: no absolute path, no '..', and none that resolves outside it.",
                "items": {
                  "type": "string"
                }
              },
              "when_missing": {
                "enum": [
                  "UNVERIFIED",
                  "FAIL"
                ]
              }
            }
          },
          "timeout_seconds": {
            "type": "number",
            "description": "Seconds after which this claim's command, with everything it started, is stopped and reads UNVERIFIED; it takes the place of the plan's timeout_seconds. Optional: with neither set there is no timeout."
          },
          "paths": {
            "type": "array",
            "items": {
              "type": "string"
            },
            "description": "Optional files and folders, relative to the plan's working directory, whose change can change this claim's result ('.' is the whole working directory). A declaration by the plan's author, which the runner does not check against the command. `outcomebound validation status` intersects it with what changed since the claim's last result."
          },
          "environment": {
            "type": "array",
            "items": {
              "type": "string"
            },
            "description": "Optional names of environment variables whose values can change this claim's result. A run records a digest of each (never the value); `outcomebound validation status` reads a claim as UNVERIFIED where one differs."
          }
        }
      }
    }
  }
}
