{
  "version": 1,
  "cwd": ".",
  "timeout_seconds": 120,
  "claims": [
    {
      "name": "cents-on-a-new-database",
      "risk": "a new database does not keep prices as integer cents, or add, list or value changed what they take or print",
      "kind": "test",
      "required": true,
      "command": [
        "sh",
        "-c",
        "python3 -B \"${OUTCOMEBOUND_GRADER_DIR:?the runner sets OUTCOMEBOUND_GRADER_DIR}/checks/footprint.py\"; exec python3 -B \"${OUTCOMEBOUND_GRADER_DIR:?the runner sets OUTCOMEBOUND_GRADER_DIR}/checks/probe_cents.py\" new"
      ]
    },
    {
      "name": "existing-stock-survives",
      "risk": "the stock recorded before the change is lost, misread or left in the old form once migrations run",
      "kind": "test",
      "required": true,
      "command": [
        "sh",
        "-c",
        "exec python3 -B \"${OUTCOMEBOUND_GRADER_DIR:?the runner sets OUTCOMEBOUND_GRADER_DIR}/checks/probe_cents.py\" existing"
      ]
    }
  ]
}
