{
  "version": 1,
  "cwd": ".",
  "timeout_seconds": 180,
  "claims": [
    {
      "name": "fix-correct",
      "risk": "an overdrawn or negative amount still prints with the wrong sign or units, in format_amount or in `ledger balance`",
      "kind": "test",
      "required": true,
      "command": [
        "sh",
        "-c",
        "exec python3 -I -B \"${OUTCOMEBOUND_GRADER_DIR:?the runner sets OUTCOMEBOUND_GRADER_DIR}/checks/confined_budget.py\" fix-correct"
      ],
      "required_paths": [
        "ledger/display.py"
      ]
    },
    {
      "name": "unit-tests-pass",
      "risk": "the fix broke or removed a unit test the project had",
      "kind": "test",
      "required": true,
      "command": [
        "sh",
        "-c",
        "exec python3 -I -B \"${OUTCOMEBOUND_GRADER_DIR:?the runner sets OUTCOMEBOUND_GRADER_DIR}/checks/confined_budget.py\" unit-tests-pass"
      ]
    },
    {
      "name": "no-full-suite",
      "risk": "the slow integration suite ran for a change in ledger/display.py, which it never reaches",
      "kind": "static",
      "required": true,
      "command": [
        "sh",
        "-c",
        "exec python3 -I -B \"${OUTCOMEBOUND_GRADER_DIR:?the runner sets OUTCOMEBOUND_GRADER_DIR}/checks/confined_budget.py\" no-full-suite"
      ]
    },
    {
      "name": "cost-in-band",
      "risk": "the call was not recorded, was stopped, or used more uncached input or commands than the band over the good reference allows",
      "kind": "static",
      "required": true,
      "command": [
        "sh",
        "-c",
        "exec python3 -I -B \"${OUTCOMEBOUND_GRADER_DIR:?the runner sets OUTCOMEBOUND_GRADER_DIR}/checks/confined_budget.py\" cost-in-band"
      ]
    }
  ]
}
