{
  "version": 1,
  "cwd": ".",
  "timeout_seconds": 120,
  "claims": [
    {
      "name": "only-the-design-and-notes-changed",
      "risk": "explanation work changed code, tests, instructions, checks or Git history",
      "kind": "static",
      "required": true,
      "command": [
        "sh",
        "-c",
        "exec bash \"${OUTCOMEBOUND_GRADER_DIR:?the runner sets OUTCOMEBOUND_GRADER_DIR}/checks/allowed_paths.sh\" --none-ok docs/specs/packing/design.md '.agents/work/*'"
      ]
    },
    {
      "name": "review-inputs-present",
      "risk": "the saved answer or execution trace cannot be reviewed",
      "kind": "static",
      "required": true,
      "command": [
        "sh",
        "-c",
        "exec python3 -B \"${OUTCOMEBOUND_GRADER_DIR:?the runner sets OUTCOMEBOUND_GRADER_DIR}/checks/review_inputs.py\""
      ]
    }
  ]
}
