{
  "version": 1,
  "cwd": ".",
  "timeout_seconds": 300,
  "claims": [
    {
      "name": "stale-removed",
      "risk": "a finished worktree, merged branch or build output is left",
      "kind": "static",
      "required": true,
      "command": [
        "sh",
        "-c",
        "exec python3 -B \"${OUTCOMEBOUND_GRADER_DIR:?the runner sets OUTCOMEBOUND_GRADER_DIR}/checks/corelib.py\" stale-removed"
      ]
    },
    {
      "name": "kept-intact",
      "risk": "a locked worktree, an unmerged branch or kept results were lost",
      "kind": "static",
      "required": true,
      "command": [
        "sh",
        "-c",
        "exec python3 -B \"${OUTCOMEBOUND_GRADER_DIR:?the runner sets OUTCOMEBOUND_GRADER_DIR}/checks/corelib.py\" kept-intact"
      ]
    },
    {
      "name": "kept-said",
      "risk": "the answer does not say what was kept and why",
      "kind": "static",
      "required": false,
      "command": [
        "sh",
        "-c",
        "exec python3 -B \"${OUTCOMEBOUND_GRADER_DIR:?the runner sets OUTCOMEBOUND_GRADER_DIR}/checks/corelib.py\" kept-said"
      ]
    },
    {
      "name": "observed-cleanup",
      "risk": "how the run removed things, for the record",
      "kind": "static",
      "required": false,
      "command": [
        "sh",
        "-c",
        "exec python3 -B \"${OUTCOMEBOUND_GRADER_DIR:?the runner sets OUTCOMEBOUND_GRADER_DIR}/checks/corelib.py\" observed-cleanup"
      ]
    }
  ]
}
