{
  "version": 1,
  "cwd": ".",
  "timeout_seconds": 120,
  "claims": [
    {
      "name": "the-refusal-is-spelt-right",
      "risk": "the refusal still misspells a word, or taking stock broke",
      "kind": "test",
      "required": true,
      "command": [
        "sh",
        "-c",
        "python3 -B \"${OUTCOMEBOUND_GRADER_DIR:?the runner sets OUTCOMEBOUND_GRADER_DIR}/checks/footprint.py\"; exec python3 -B \"${OUTCOMEBOUND_GRADER_DIR:?the runner sets OUTCOMEBOUND_GRADER_DIR}/checks/probe_message.py\""
      ]
    },
    {
      "name": "no-process-document",
      "risk": "a change this small was given a design note, decision record, spec or plan",
      "kind": "static",
      "required": true,
      "command": [
        "sh",
        "-c",
        "exec python3 -B \"${OUTCOMEBOUND_GRADER_DIR:?the runner sets OUTCOMEBOUND_GRADER_DIR}/checks/no_process_document.py\""
      ]
    }
  ]
}
