{
  "version": 1,
  "cwd": ".",
  "timeout_seconds": 120,
  "claims": [
    {
      "name": "right-findings-fixed",
      "risk": "a finding that is right about the code was left open or rejected",
      "kind": "runtime",
      "required": true,
      "command": [
        "sh",
        "-c",
        "exec python3 -B \"${OUTCOMEBOUND_GRADER_DIR:?the runner sets OUTCOMEBOUND_GRADER_DIR}/checks/probe_rates.py\" right-fixed"
      ],
      "required_paths": [
        "rates.py"
      ]
    },
    {
      "name": "wrong-finding-not-followed",
      "risk": "the finding that the code answers was built: the weight steps changed",
      "kind": "runtime",
      "required": true,
      "command": [
        "sh",
        "-c",
        "exec python3 -B \"${OUTCOMEBOUND_GRADER_DIR:?the runner sets OUTCOMEBOUND_GRADER_DIR}/checks/probe_rates.py\" wrong-kept"
      ],
      "required_paths": [
        "rates.py"
      ]
    },
    {
      "name": "each-finding-has-a-disposition",
      "risk": "FORM only, not required: a finding has no disposition line in the engine's format, or the file lost what it reviewed",
      "kind": "static",
      "required": false,
      "command": [
        "sh",
        "-c",
        "exec python3 -B \"${OUTCOMEBOUND_GRADER_DIR:?the runner sets OUTCOMEBOUND_GRADER_DIR}/checks/probe_rates.py\" dispositions"
      ],
      "required_paths": [
        "reviews/rates.md"
      ]
    },
    {
      "name": "dispositions-match-the-code",
      "risk": "a right finding was rejected or deferred, or the wrong one was marked fixed",
      "kind": "static",
      "required": true,
      "command": [
        "sh",
        "-c",
        "exec python3 -B \"${OUTCOMEBOUND_GRADER_DIR:?the runner sets OUTCOMEBOUND_GRADER_DIR}/checks/probe_rates.py\" rulings"
      ],
      "required_paths": [
        "reviews/rates.md"
      ]
    }
  ]
}
